{"schema":"https://agent-orchestrator.dev/quality/schemas/change-review-verdict.v1.schema.json","schemaVersion":1,"repository":"default","baseSha":"a0dacb7d5238e4512ff6d188b698184bc2c23422","headSha":"bbf3298e0c37dbcbb9bf92fe68a04e1546c939f5","verdict":"pass","policyHash":"sha256:709fe0fe23ef6adff316166e3c8e13a12774064eb119512b13a9d3f2484c7764","ruleSetHash":"sha256:c4ae562e5e318dbe1fd9ffba7665e53740a022796589059113905422469d76c0","catalogueVersion":"1.6.0","findings":[],"failureReason":null,"model":"gpt-6-luna","thinkingLevel":"low","usage":{"inputTokens":34445,"outputTokens":9,"cachedInputTokens":11008,"reasoningOutputTokens":0,"durationMs":5151},"durationMilliseconds":7112}
