{"schema":"https://agent-orchestrator.dev/quality/schemas/change-review-verdict.v1.schema.json","schemaVersion":1,"repository":"default","baseSha":"b225a6e70d472c01d2fe856f35eca256c2c9c021","headSha":"df3e5365706754b2a37f717cca87374c05511bb6","verdict":"block","policyHash":"sha256:709fe0fe23ef6adff316166e3c8e13a12774064eb119512b13a9d3f2484c7764","ruleSetHash":"sha256:c4ae562e5e318dbe1fd9ffba7665e53740a022796589059113905422469d76c0","catalogueVersion":"1.6.0","findings":[{"id":"finding-d9049cacdd640da44394c89976f741befb182f9f128df4987d9d70694daa20a5","fingerprint":"sha256:d9049cacdd640da44394c89976f741befb182f9f128df4987d9d70694daa20a5","ruleId":"QS-GN-002","ruleVersion":"1.0.0","severity":"high","path":"backend/Features/Pipeline/BatchGate/BatchGatePilotService.cs","side":"head","line":896,"message":"The per-task fallback invokes the gate with a 45-minute timeout value, but this method does not enforce a wall-clock bound around the awaited gate call. A runner that ignores its timeout can leave the task in Auto Review and the fallback flight running indefinitely.","evidenceChecked":"The call passes `TimeSpan.FromMinutes(45)` to `_gate.RunAsync` and awaits it directly; the catch only handles exceptions after the call returns.","missing":"Enforce a timeout or cancellation deadline around the awaited operation and escalate or otherwise refuse clearly when it expires.","disposition":"block"}],"failureReason":null,"model":"gpt-6-luna","thinkingLevel":"low","usage":{"inputTokens":81546,"outputTokens":181,"cachedInputTokens":3840,"reasoningOutputTokens":0,"durationMs":9988},"durationMilliseconds":11391}
