{"schema":"https://agent-orchestrator.dev/quality/schemas/change-review-verdict.v1.schema.json","schemaVersion":1,"repository":"default","baseSha":"79668c04d64eb1304dd2532203f5efb20adecb72","headSha":"eb6bc510427052f79d752efba57e2e18bb588357","verdict":"block","policyHash":"sha256:709fe0fe23ef6adff316166e3c8e13a12774064eb119512b13a9d3f2484c7764","ruleSetHash":"sha256:c4ae562e5e318dbe1fd9ffba7665e53740a022796589059113905422469d76c0","catalogueVersion":"1.6.0","findings":[{"id":"finding-dcac76626a2a4d0d6fded4e4571988d97b7cd2c4ff925f7a27e1dc083e156cf3","fingerprint":"sha256:dcac76626a2a4d0d6fded4e4571988d97b7cd2c4ff925f7a27e1dc083e156cf3","ruleId":"QS-GN-002","ruleVersion":"1.0.0","severity":"high","path":"frontend/e2e/mockups/usage-header.spec.ts","side":"head","line":29,"message":"The mock server decodes the caller-controlled URL path and joins it to the build directory without checking that the resolved path remains inside that directory. A path containing encoded traversal segments can therefore make the server read and serve files outside the mock bundle. Normalize and constrain the resolved path before reading it.","evidenceChecked":"The request handler applies `decodeURIComponent` to `req.url`, passes the result to `path.join(DIST_DIR, ...)`, and reads the resulting path; there is no containment check before `existsSync`, `statSync`, or streaming.","missing":"A resolved-path boundary check that rejects paths outside `DIST_DIR`.","disposition":"block"},{"id":"finding-88e114849ad37f0c0025ce1aa3547a8b6e5bae8246619bd505ce83332bfb628e","fingerprint":"sha256:88e114849ad37f0c0025ce1aa3547a8b6e5bae8246619bd505ce83332bfb628e","ruleId":"QS-GN-001","ruleVersion":"1.0.1","severity":"high","path":"frontend/src/app/features/studio-shell/studio-shell.header-cockpit.ts","side":"head","line":71,"message":"The saved CLI preference is read from localStorage, but this class can run during server rendering where localStorage is unavailable. That can throw while computing the header’s default CLI and prevent the shell from rendering. Guard access for non-browser environments.","evidenceChecked":"The computed value calls `localStorage.getItem(STORAGE_DEFAULT_CLI)` directly, and the new class is constructed by the Studio shell; no browser-environment guard is present in this code.","missing":"A check that localStorage is available before reading it.","disposition":"block"},{"id":"finding-f2c494ca6fb07ac2240f21bba8e04ee796a2c030b9319c6aafe34fbc90c055f8","fingerprint":"sha256:f2c494ca6fb07ac2240f21bba8e04ee796a2c030b9319c6aafe34fbc90c055f8","ruleId":"QS-GN-002","ruleVersion":"1.0.0","severity":"high","path":"frontend/src/app/features/usage-cockpit/services/usage-cockpit.service.ts","side":"head","line":56,"message":"Each refresh unsubscribes the previous request, but the service does not place a timeout on the HTTP request. If the request stalls without completing, the snapshot can remain loading indefinitely and polling repeatedly replaces the stalled request. Bound request duration and report the timeout as a failed read.","evidenceChecked":"`refresh()` subscribes directly to `HttpClient.get()` and only handles `next` and `error`; there is no timeout or other wall-clock bound in this service.","missing":"An enforced request-duration limit with a failure state when it expires.","disposition":"block"}],"failureReason":null,"model":"gpt-6-luna","thinkingLevel":"low","usage":{"inputTokens":44229,"outputTokens":462,"cachedInputTokens":3840,"reasoningOutputTokens":0,"durationMs":8598},"durationMilliseconds":10903}
